{
  "schemaVersion": 2,
  "runId": "phase-6f-run-sha256:aaaaaaaaaaaaaaaaaaaaaaaaaaaaaaaaaaaaaaaaaaaaaaaaaaaaaaaaaaaaaaaa",
  "recordDigest": "sha256:34292ad7291b2416698ee2839d5667f09425525c55c19ebd61cafdaeea255b22",
  "capturedAt": "2026-08-20T00:00:00Z",
  "workflowId": "retroarch-plus-bios",
  "workflowVersion": 1,
  "deviceTarget": {
    "id": "device-target-sha256:8b9f6cf2dc8831a9188c2ad1d85b8a83ea8e8baf0d674943b7d5e9925f047c62",
    "profileId": {
      "value": "ayaneo.pocket_s2",
      "source": "production_observation"
    },
    "manufacturer": {
      "value": "AYANEO",
      "source": "production_observation"
    },
    "model": {
      "value": "Synthetic Pocket S2",
      "source": "production_observation"
    },
    "androidVersion": {
      "value": "15",
      "source": "production_observation"
    },
    "androidApi": {
      "value": 35,
      "source": "production_observation"
    },
    "abiSocClass": {
      "value": "arm64-snapdragon",
      "source": "production_observation"
    },
    "rootState": {
      "value": "non_root",
      "source": "explicit_root_check"
    },
    "connectionType": {
      "value": "usb3",
      "source": "operator_attestation"
    },
    "firmwareBuild": {
      "value": "synthetic/build",
      "source": "production_observation"
    }
  },
  "fingerprint": {
    "schemaVersion": 2,
    "emuchefBuild": "2026-08-21-foundation",
    "workflowVersion": 1,
    "authoredContent": [
      {
        "id": "app.retroarch.provision",
        "sha256": "aaaaaaaaaaaaaaaaaaaaaaaaaaaaaaaaaaaaaaaaaaaaaaaaaaaaaaaaaaaaaaaa"
      },
      {
        "id": "feature.copy_bios",
        "sha256": "bbbbbbbbbbbbbbbbbbbbbbbbbbbbbbbbbbbbbbbbbbbbbbbbbbbbbbbbbbbbbbbb"
      }
    ],
    "runtimeContract": "v1",
    "deviceProfile": "ayaneo.pocket_s2",
    "androidApi": 35,
    "firmwareBuild": "synthetic/build",
    "abiSocClass": "arm64-snapdragon",
    "rootState": "non_root",
    "connectionType": "usb3"
  },
  "fingerprintDigest": "sha256:16812c05852083b785df39c0dc9a037ab81c32aa852a942fc47aa559f5d884f7",
  "runValidity": "valid",
  "qualificationOutcome": "passed",
  "automatedObservations": [
    {
      "id": "execution-report",
      "outcome": "passed",
      "observedAt": "2026-08-20T00:01:00Z"
    }
  ],
  "humanCheckpoints": [],
  "targetWideFailure": null,
  "limitations": []
}
