{
  "schemaVersion": 2,
  "runId": "qualification-run-sha256:cccccccccccccccccccccccccccccccccccccccccccccccccccccccccccccccc",
  "recordDigest": "sha256:e5be7e0922ff1d6d435f4747474329e52df06bd486f166ff058395c96d342f6e",
  "capturedAt": "2026-08-19T00:00:00Z",
  "workflowId": "obtainium-install",
  "workflowVersion": 1,
  "deviceTarget": {
    "id": "device-target-sha256:8b9f6cf2dc8831a9188c2ad1d85b8a83ea8e8baf0d674943b7d5e9925f047c62",
    "profileId": {
      "value": "ayaneo.pocket_s2",
      "source": "production_observation"
    },
    "manufacturer": {
      "value": "AYANEO",
      "source": "production_observation"
    },
    "model": {
      "value": "Synthetic Pocket S2",
      "source": "production_observation"
    },
    "androidVersion": {
      "value": "15",
      "source": "production_observation"
    },
    "androidApi": {
      "value": 35,
      "source": "production_observation"
    },
    "abiSocClass": {
      "value": "arm64-snapdragon",
      "source": "production_observation"
    },
    "rootState": {
      "value": "non_root",
      "source": "explicit_root_check"
    },
    "connectionType": {
      "value": "usb3",
      "source": "operator_attestation"
    },
    "firmwareBuild": {
      "value": "synthetic/build",
      "source": "production_observation"
    }
  },
  "fingerprint": {
    "schemaVersion": 2,
    "emuchefBuild": "2026-08-19-old-build",
    "workflowVersion": 1,
    "authoredContent": [
      {
        "id": "app.obtainium.install",
        "sha256": "cccccccccccccccccccccccccccccccccccccccccccccccccccccccccccccccc"
      }
    ],
    "runtimeContract": "v1",
    "deviceProfile": "ayaneo.pocket_s2",
    "androidApi": 35,
    "firmwareBuild": "synthetic/build",
    "abiSocClass": "arm64-snapdragon",
    "rootState": "non_root",
    "connectionType": "usb3"
  },
  "fingerprintDigest": "sha256:ea8ab3970b4f21abe5979cafbf4fcb5c15bfd46cd25eb744e8021e42601a5501",
  "runValidity": "valid",
  "qualificationOutcome": "passed",
  "automatedObservations": [
    {
      "id": "execution-report",
      "outcome": "passed",
      "observedAt": "2026-08-19T00:01:00Z"
    }
  ],
  "humanCheckpoints": [],
  "targetWideFailure": null,
  "limitations": []
}
