{
  "schemaVersion": 2,
  "runId": "phase-6f-run-sha256:eeeeeeeeeeeeeeeeeeeeeeeeeeeeeeeeeeeeeeeeeeeeeeeeeeeeeeeeeeeeeeee",
  "recordDigest": "sha256:d69945d37ec208e433ffd6f2f3c7d7c7677da6cb685dccd9cc4ca3095dcec027",
  "capturedAt": "2026-08-18T00:00:00Z",
  "workflowId": "xaniteog-install",
  "workflowVersion": 1,
  "deviceTarget": {
    "id": "device-target-sha256:8b9f6cf2dc8831a9188c2ad1d85b8a83ea8e8baf0d674943b7d5e9925f047c62",
    "profileId": {
      "value": "ayaneo.pocket_s2",
      "source": "production_observation"
    },
    "manufacturer": {
      "value": "AYANEO",
      "source": "production_observation"
    },
    "model": {
      "value": "Synthetic Pocket S2",
      "source": "production_observation"
    },
    "androidVersion": {
      "value": "15",
      "source": "production_observation"
    },
    "androidApi": {
      "value": 35,
      "source": "production_observation"
    },
    "abiSocClass": {
      "value": "arm64-snapdragon",
      "source": "production_observation"
    },
    "rootState": {
      "value": "non_root",
      "source": "explicit_root_check"
    },
    "connectionType": {
      "value": "usb3",
      "source": "operator_attestation"
    },
    "firmwareBuild": {
      "value": "synthetic/build",
      "source": "production_observation"
    }
  },
  "fingerprint": {
    "schemaVersion": 2,
    "emuchefBuild": "2026-08-21-foundation",
    "workflowVersion": 1,
    "authoredContent": [
      {
        "id": "app.xaniteog.install",
        "sha256": "dddddddddddddddddddddddddddddddddddddddddddddddddddddddddddddddd"
      }
    ],
    "runtimeContract": "v1",
    "deviceProfile": "ayaneo.pocket_s2",
    "androidApi": 35,
    "firmwareBuild": "synthetic/build",
    "abiSocClass": "arm64-snapdragon",
    "rootState": "non_root",
    "connectionType": "usb3"
  },
  "fingerprintDigest": "sha256:0d585947ae87c17de019e2e3163bfc028af551374928d4d2249f09e8fafe1dd8",
  "runValidity": "valid",
  "qualificationOutcome": "passed",
  "automatedObservations": [
    {
      "id": "execution-report",
      "outcome": "passed",
      "observedAt": "2026-08-18T00:01:00Z"
    }
  ],
  "humanCheckpoints": [],
  "targetWideFailure": null,
  "limitations": []
}
